title,summary,detail_url,resource_type
Disability-Related Accommodation Process,"The academic accommodation process is a collaborative effort between students and Accessible Learning. The goal is to reach agreement on appropriate accommodations, ensuring students have equitable access to their education. Faculty may be involved in this process as experts in academic requirements.While we do not share students’ health...",https://successportal.conestogac.on.ca/students/faqs/detail/93/disability-related-accommodati,faq
Conestoga Laptop and Technology Orientation,,https://successportal.conestogac.on.ca/students/links/detail/91,link
Tech Help,,https://successportal.conestogac.on.ca/students/links/detail/90,link
TechFAQ,,https://successportal.conestogac.on.ca/students/links/detail/89,link
Digital Skills Toolkit,,https://successportal.conestogac.on.ca/students/links/detail/88,link
Before Your Assessment,Tips of what to do before writing in the Test Centre,https://successportal.conestogac.on.ca/students/infoPages/detail/42/before-your-assessment,link
After Your Assessment,What to expect after an assessment in the Test Centre,https://successportal.conestogac.on.ca/students/infoPages/detail/44/after-your-assessment,link
During Your Assessment,Considerations for during your assessment in the Test Centre,https://successportal.conestogac.on.ca/students/infoPages/detail/43/during-your-assessment,link
Student Rights & Responsibilities FAQs,"Who do I contact if I have an emergency or safety concern?If you feel unsafe or need immediate attention on-campus, contact Safety and Security.If you are off campus, contact emergency services by calling 911.If you are in crisis and need urgent mental health support, the following resources can help: 
Suicide Crisis Helpline (all of Canada):...",https://successportal.conestogac.on.ca/students/faqs/detail/92/student-rights-and-responsibil,faq
